{
  "schemaVersion": "mi-training-v1",
  "baseModel": {"id": "../../../../base-models/downloaded/gemma/gemma-3-1b-it", "revision": null, "dtype": "bfloat16", "device": "cuda:0", "allowDownload": false},
  "registry": "../../../../facets/mi-benchmark-2k/gemma",
  "facet": {
    "id": "coder",
    "version": "data2k-2026-08-23",
    "description": "Code-design parent facet trained on the canonical 2k+ corpus",
    "dependencies": {"requires": [], "priority": 20},
    "module": {"type": "full-decoder-block", "slots": [
      {"id": "coder-early", "afterLayer": 8, "order": 10, "blocks": [{"sourceLayer": 8, "initializer": "identity-copy"}]},
      {"id": "coder-middle", "afterLayer": 16, "order": 10, "blocks": [{"sourceLayer": 16, "initializer": "identity-copy"}]}
    ]},
    "metadata": {"benchmark": "model-family-data2k", "family": "gemma", "role": "parent", "datasetFacet": "coder", "corpusGenerator": "coder-corpora-v1"}
  },
  "data": {
    "train": [
      {"path": "../../../../datasets/facet-infrastructure/facets/coder/pretraining.jsonl", "stages": ["continued-pretraining"]},
      {"path": "../../../../datasets/facet-infrastructure/facets/coder/training.jsonl", "stages": ["sft", "preference", "recovery", "composition"], "repeat": 2}
    ],
    "maxSequenceLength": 512, "maskPrompt": true, "packing": false, "shuffle": true, "numWorkers": 0
  },
  "algorithm": {"type": "causal-lm"},
  "optimizer": {"type": "adamw", "learningRate": 0.0000005, "weightDecay": 0.01, "betas": [0.9, 0.95]},
  "scheduler": {"type": "cosine", "warmupRatio": 0.05},
  "training": {"epochs": 1, "maxSteps": 256, "batchSize": 1, "gradientAccumulationSteps": 1, "precision": "bfloat16", "gradientCheckpointing": true, "maxGradNorm": 1.0, "seed": 42, "logEverySteps": 16, "evaluateEverySteps": 0, "identityCheck": true},
  "checkpoint": {"outputDirectory": "../../../../facets/mi-benchmark-2k/gemma/coder/data2k-2026-08-23", "overwrite": true, "saveEverySteps": 0, "saveOptimizer": false}
}
