{
  "schemaVersion": "mi-training-v1",
  "baseModel": {
    "id": "../../../../base-models/downloaded/gemma/gemma-3-1b-it",
    "revision": null,
    "dtype": "bfloat16",
    "device": "cuda:0",
    "allowDownload": false
  },
  "registry": "../../../../facets/mi-benchmark/gemma",
  "facet": {
    "id": "coder",
    "version": "smoke-2026-08-23",
    "description": "Parent code-design facet for the three-family MI smoke benchmark",
    "dependencies": {"requires": [], "priority": 20},
    "module": {
      "type": "full-decoder-block",
      "slots": [
        {"id": "coder-early", "afterLayer": 8, "order": 10, "blocks": [{"sourceLayer": 8, "initializer": "identity-copy"}]},
        {"id": "coder-middle", "afterLayer": 16, "order": 10, "blocks": [{"sourceLayer": 16, "initializer": "identity-copy"}]}
      ]
    },
    "metadata": {"benchmark": "model-family-smoke", "family": "gemma", "role": "parent", "datasetFacet": "coder"}
  },
  "data": {
    "train": [
      {"path": "../../../../datasets/facet-infrastructure/facets/coder/pretraining.jsonl", "stages": ["continued-pretraining"]},
      {"path": "../../../../datasets/facet-infrastructure/facets/coder/training.jsonl", "stages": ["sft"], "limit": 4}
    ],
    "maxSequenceLength": 256,
    "maskPrompt": true,
    "packing": false,
    "shuffle": true,
    "numWorkers": 0
  },
  "algorithm": {"type": "causal-lm"},
  "optimizer": {"type": "adamw", "learningRate": 0.000002, "weightDecay": 0.01, "betas": [0.9, 0.95]},
  "scheduler": {"type": "constant", "warmupSteps": 0},
  "training": {"epochs": 1, "maxSteps": 6, "batchSize": 1, "gradientAccumulationSteps": 1, "precision": "bfloat16", "gradientCheckpointing": true, "maxGradNorm": 1.0, "seed": 42, "logEverySteps": 1, "evaluateEverySteps": 0, "identityCheck": true},
  "checkpoint": {"outputDirectory": "../../../../facets/mi-benchmark/gemma/coder/smoke-2026-08-23", "overwrite": true, "saveEverySteps": 0, "saveOptimizer": false}
}
